{"$schema":"https://json-schema.org/draft/2020-12/schema","$id":"cups.schema.json","type":"array","minItems":1,"items":{"type":"object","additionalProperties":false,"required":["slug","name","short","cadence","format","schema","accent","docs"],"properties":{"slug":{"type":"string","pattern":"^[a-z0-9]+(?:-[a-z0-9]+)*$"},"name":{"type":"string","minLength":1},"short":{"type":"string","minLength":1},"cadence":{"type":"string","minLength":1},"format":{"type":"string","minLength":1},"schema":{"enum":["season","roster"]},"accent":{"type":"string","minLength":1},"docs":{"type":"string","pattern":"^docs/.+\\.md$"}}}}
